title,url,by,author,price,category
Sub-$200 Lidar could reshuffle auto sensor economics,https://spectrum.ieee.org/solid-state-lidar-microvision-adas,mhb,,,
"I built Timeframe, our family e-paper dashboard",https://hawksley.org/2026/02/17/timeframe.html,saeedesmaili,,,
0 A.D. Release 28: Boiorix,https://play0ad.com/new-release-0-a-d-release-28-boiorix/,jonbaer,,,
"Pope tells priests to use their brains, not AI, to write homilies",https://www.ewtnnews.com/vatican/pope-leo-xiv-tells-priests-to-use-their-brains-not-ai-to-write-homilies,josephcsible,,,
Elsevier Shuts Down Its Finance Journal Citation Cartel,https://www.chrisbrunet.com/p/elsevier-shuts-down-its-finance-journal,qsi,,,
Sunday Daily Thread: What's everyone working on this week?,https://www.reddit.com/r/Python/comments/1rb6o4p/sunday_daily_thread_whats_everyone_working_on/,,AutoModerator,,
Monday Daily Thread: Project ideas!,https://www.reddit.com/r/Python/comments/1rc1z83/monday_daily_thread_project_ideas/,,AutoModerator,,
"Title: I built WSE — Rust-accelerated WebSocket engine for Python (2M msg/s, E2E encrypted)",https://www.reddit.com/r/Python/comments/1rc8crk/title_i_built_wse_rustaccelerated_websocket/,,Direct_Alfalfa_3829,,
I built an interactive Python book that lets you code while you learn (Basics to Advanced),https://www.reddit.com/r/Python/comments/1rbt9ok/i_built_an_interactive_python_book_that_lets_you/,,Regular-Entrance-205,,
"VOLUNTEER: Code In Place, section leader opportunity teaching intro Python",https://www.reddit.com/r/Python/comments/1rcavea/volunteer_code_in_place_section_leader/,,Friendly-Example-701,,
"Fjallraven - Foldsack No. 1 Backpack, Fits 15 Laptops",,,,109.95,men's clothing
Mens Casual Premium Slim Fit T-Shirts ,,,,22.3,men's clothing
Mens Cotton Jacket,,,,55.99,men's clothing
Mens Casual Slim Fit,,,,15.99,men's clothing
John Hardy Women's Legends Naga Gold & Silver Dragon Station Chain Bracelet,,,,695.0,jewelery
